{
  "problem_id": "graph_flow_conservation",
  "timestamp_utc": "2026-01-22T05:19:05.048901+00:00",
  "runner": "validation/run_validation.py",
  "known_invariants": [
    "flow_conservation"
  ],
  "expected_behavior": {
    "max_flow": 18,
    "conservation": "net flow zero at internal nodes"
  },
  "run_config": {
    "graph": "clrs_s_u_v_t",
    "expected_max_flow": 18
  },
  "observations": {
    "max_flow": 18,
    "flow_error": 0,
    "imbalance": {
      "v": 0,
      "u": 0
    },
    "max_imbalance": 0,
    "engine": null
  },
  "verdict": "passes_within_tolerance",
  "notes": "Pure Python Edmonds-Karp on a small graph; replace with engine-backed flow if available."
}