{
  "problem_id": "lorenz_invariant_measure",
  "timestamp_utc": "2026-01-21T19:44:08.048685+00:00",
  "runner": "validation/run_validation.py",
  "known_invariants": [
    "bounded_state"
  ],
  "expected_behavior": {
    "bounded_state": true,
    "attractor_shape": "butterfly",
    "rho": 28.0,
    "sigma": 10.0,
    "beta": 2.6666666666666665
  },
  "run_config": {
    "dt": 0.01,
    "steps": 10000,
    "initial": [
      1.0,
      1.0,
      1.0
    ]
  },
  "observations": {
    "max_radius": 52.189211139359124,
    "min_radius": 1.8928009411595346,
    "final_state": [
      0.3984781743105972,
      0.7357020514634592,
      10.659565937310285
    ],
    "bounded": true
  },
  "verdict": "passes_within_tolerance",
  "notes": "RK4 Lorenz reference; integrate engine-backed chaos checks if available."
}